{
  "metadata": {
    "artifact_type": "glossary_independent_audit_report",
    "artifact_version": "1.0.0",
    "schema_version": "1.0.0",
    "batch_id": "glossary_batch_001_data_analyst_pilot",
    "run_id": "glossary_batch_001_data_analyst_pilot_16_final_audit",
    "prompt_version": "16_final_audit@v1",
    "model": "us.anthropic.claude-opus-4-5-20251101-v1:0,us.anthropic.claude-opus-4-6-v1,us.anthropic.claude-sonnet-4-6",
    "generated_at": "2026-10-17T20:44:45+00:00",
    "source_snapshot_id": "glossary_batch_001_data_analyst_pilot",
    "parent_artifact_hashes": {
      "path_glossary_bundle.data_analyst.json": "03da6dfb50121394dc36861ae96c45e2a6d2fe6d92863d7bbe2b9b556dd29426"
    }
  },
  "batch_id": "glossary_batch_001_data_analyst_pilot",
  "reviewed_bundle_ids": [
    "data.dataset_rows_columns:data_analyst",
    "data.categorical_numeric_types:data_analyst",
    "data.data_quality_basics:data_analyst",
    "data.analysis_workflow:data_analyst",
    "data.ethics_privacy_basics:data_analyst",
    "python.variables_assignment:data_analyst",
    "python.core_data_types:data_analyst",
    "python.arithmetic_operators:data_analyst",
    "python.comparison_operators:data_analyst",
    "python.logical_operators:data_analyst",
    "python.type_conversion:data_analyst",
    "python.lists:data_analyst",
    "python.dictionaries:data_analyst",
    "python.tuples:data_analyst",
    "python.sets:data_analyst",
    "python.string_basics_formatting:data_analyst",
    "python.conditional_statements:data_analyst",
    "python.for_loops:data_analyst",
    "python.while_loops:data_analyst",
    "python.loop_control:data_analyst",
    "python.comprehensions:data_analyst",
    "python.iterating_collections:data_analyst",
    "python.defining_calling_functions:data_analyst",
    "python.parameters_arguments:data_analyst",
    "python.return_values:data_analyst",
    "python.function_default_keyword_args:data_analyst",
    "python.variable_scope:data_analyst",
    "python.error_handling:data_analyst",
    "python.import_statements:data_analyst",
    "python.file_io:data_analyst",
    "python.pep8_style:data_analyst",
    "stats.descriptive_measures_of_center:data_analyst",
    "stats.measures_of_spread:data_analyst",
    "stats.distribution_shape:data_analyst",
    "stats.outlier_reasoning:data_analyst",
    "stats.frequency_distribution_reading:data_analyst",
    "stats.correlation:data_analyst",
    "stats.correlation_interpretation:data_analyst",
    "stats.correlation_vs_causation_caveat:data_analyst",
    "pandas.dataframe_series_model:data_analyst",
    "pandas.reading_data:data_analyst",
    "pandas.creating_dataframes:data_analyst",
    "pandas.inspecting_dataframes:data_analyst",
    "stats.pandas_descriptive_stats:data_analyst",
    "pandas.loc_iloc_selection:data_analyst",
    "pandas.boolean_filtering:data_analyst",
    "pandas.sort_values:data_analyst",
    "pandas.rename_columns_index:data_analyst",
    "pandas.dtype_conversion:data_analyst",
    "pandas.datetime_handling:data_analyst",
    "pandas.str_accessor_cleaning:data_analyst",
    "pandas.drop_duplicates:data_analyst",
    "pandas.missing_data_handling:data_analyst",
    "pandas.map_substitution:data_analyst",
    "pandas.apply_transform:data_analyst",
    "pandas.concat_stacking:data_analyst",
    "pandas.merge_join:data_analyst",
    "pandas.groupby_aggregation:data_analyst",
    "pandas.melt_reshaping:data_analyst",
    "pandas.pivot_table_reshaping:data_analyst",
    "pandas.export_to_csv:data_analyst",
    "sql.relational_model:data_analyst",
    "sql.select_fundamentals:data_analyst",
    "sql.aliasing:data_analyst",
    "sql.distinct:data_analyst",
    "sql.where_filtering:data_analyst",
    "sql.logical_operators:data_analyst",
    "sql.null_handling:data_analyst",
    "sql.order_by:data_analyst",
    "sql.limit_offset:data_analyst",
    "sql.aggregate_functions:data_analyst",
    "sql.group_by:data_analyst",
    "sql.having:data_analyst",
    "sql.case_expressions:data_analyst",
    "sql.style_conventions:data_analyst",
    "sql.string_functions:data_analyst",
    "sql.date_time_functions:data_analyst",
    "sql.type_casting:data_analyst",
    "sql.coalesce:data_analyst",
    "sql.union:data_analyst",
    "datamodel.entities_tables:data_analyst",
    "datamodel.primary_keys:data_analyst",
    "datamodel.foreign_keys_referential_integrity:data_analyst",
    "datamodel.one_to_many:data_analyst",
    "datamodel.normalization_basics:data_analyst",
    "datamodel.many_to_many_junction_tables:data_analyst",
    "datamodel.er_diagram_reading:data_analyst",
    "sql.inner_join:data_analyst",
    "sql.composite_join_conditions:data_analyst",
    "sql.outer_joins:data_analyst",
    "sql.clause_execution_order:data_analyst",
    "sql.subquery_in_where:data_analyst",
    "sql.subquery_in_from:data_analyst",
    "sql.cte:data_analyst",
    "spreadsheet.grid_model:data_analyst",
    "spreadsheet.cell_references_ranges:data_analyst",
    "spreadsheet.structured_tables:data_analyst",
    "spreadsheet.named_ranges:data_analyst",
    "spreadsheet.sorting:data_analyst",
    "spreadsheet.filtering:data_analyst",
    "spreadsheet.conditional_formatting:data_analyst",
    "spreadsheet.data_validation:data_analyst",
    "spreadsheet.remove_duplicates_cleaning:data_analyst",
    "spreadsheet.text_to_columns_split:data_analyst",
    "spreadsheet.cross_sheet_references:data_analyst",
    "spreadsheet.formula_syntax:data_analyst",
    "spreadsheet.relative_absolute_references:data_analyst",
    "spreadsheet.aggregation_functions:data_analyst",
    "spreadsheet.logical_functions:data_analyst",
    "spreadsheet.text_combining:data_analyst",
    "spreadsheet.text_extraction:data_analyst",
    "spreadsheet.date_functions:data_analyst",
    "spreadsheet.conditional_aggregation:data_analyst",
    "spreadsheet.vlookup_xlookup:data_analyst",
    "spreadsheet.index_match:data_analyst",
    "spreadsheet.formula_error_troubleshooting:data_analyst",
    "spreadsheet.pivot_tables:data_analyst",
    "spreadsheet.pivot_summarization:data_analyst",
    "spreadsheet.bar_chart_creation:data_analyst",
    "spreadsheet.line_chart_creation:data_analyst",
    "spreadsheet.pie_chart_creation:data_analyst",
    "viz.matplotlib_figure_axes:data_analyst",
    "viz.figure_size_layout:data_analyst",
    "viz.pyplot_basic_plotting:data_analyst",
    "viz.bar_charts:data_analyst",
    "viz.histograms:data_analyst",
    "viz.line_plots:data_analyst",
    "viz.scatter_plots:data_analyst",
    "viz.box_plots:data_analyst",
    "viz.labeling_annotation:data_analyst",
    "viz.chart_type_selection:data_analyst",
    "viz.seaborn_dataframe_plotting:data_analyst",
    "viz.seaborn_statistical_functions:data_analyst",
    "viz.seaborn_themes_palettes:data_analyst",
    "viz.custom_styling_theming:data_analyst",
    "viz.multi_panel_figures:data_analyst",
    "stats.ab_test_structure:data_analyst",
    "stats.lift_interpretation:data_analyst",
    "stats.sample_size_effect_concept:data_analyst",
    "stats.significance_confidence_concept:data_analyst",
    "stats.business_conclusion_from_experiment:data_analyst",
    "stakeholder.identifying_decision_need:data_analyst",
    "stakeholder.precise_finding_statement:data_analyst",
    "stakeholder.framing_analytical_question:data_analyst",
    "stakeholder.identifying_requirements:data_analyst",
    "stakeholder.data_driven_recommendation:data_analyst",
    "stakeholder.plain_language_translation:data_analyst",
    "stakeholder.prioritizing_findings_by_relevance:data_analyst",
    "stakeholder.actionable_recommendation_framing:data_analyst",
    "stakeholder.narrative_context_setup:data_analyst",
    "stakeholder.tailoring_detail_to_audience:data_analyst",
    "stakeholder.anticipating_questions_objections:data_analyst",
    "stakeholder.chart_type_to_point_matching:data_analyst",
    "stakeholder.simplifying_charts_for_audience:data_analyst",
    "stakeholder.presentation_structure_basics:data_analyst",
    "stakeholder.executive_summary_writing:data_analyst",
    "capstone.defining_business_question:data_analyst",
    "capstone.data_retrieval_method_selection:data_analyst",
    "capstone.end_to_end_workflow_structure:data_analyst",
    "capstone.integrate_sql:data_analyst",
    "capstone.integrate_spreadsheet:data_analyst",
    "capstone.integrate_python_pandas:data_analyst",
    "capstone.building_data_model:data_analyst",
    "capstone.applying_descriptive_statistics:data_analyst",
    "capstone.building_dashboard_or_viz:data_analyst",
    "capstone.independent_execution:data_analyst",
    "capstone.narrated_stakeholder_summary:data_analyst",
    "capstone.documenting_presenting_deliverable:data_analyst"
  ],
  "issues": [
    {
      "severity": "LOW",
      "artifact": "segment_judgments.json",
      "concept_ids": [
        "pandas.merge_join"
      ],
      "problem": "Segment prop_XMjSGGej9y8_pandas_merge_join has mean score 3.29 due to pacing issues and garbled right-join explanation; the segment is usable but the text must carry the right-join fact (f4) since the video doesn't teach it clearly.",
      "required_fix": "Confirm teaching blocks for pandas.merge_join explicitly cover right joins since the video segment does not."
    },
    {
      "severity": "LOW",
      "artifact": "segment_judgments.json",
      "concept_ids": [
        "viz.chart_type_selection"
      ],
      "problem": "Segment prop_ZyTO4SwhSeE_viz_chart_type_selection has mean score 3.43 due to verbal slip at 539s ('0 to 99' instead of '0 to 9') and pacing issues; only f2 (histogram) is confirmed, not f1 (bar chart contrast).",
      "required_fix": "Confirm teaching blocks for viz.chart_type_selection cover bar chart usage (f1) since the video segment only covers histograms."
    },
    {
      "severity": "LOW",
      "artifact": "glossary_validation_report.json",
      "concept_ids": [
        "python.return_values",
        "python.file_io",